{
  "approval_id": "APPROVAL-SIM-EVIDENCE-001",
  "request_id": "REQUEST-EVIDENCE-BUNDLE-001",
  "operation_id": "OPERATION-EVIDENCE-BUNDLE-ASSEMBLE-001",
  "operation_version": "1.0.0",
  "input_digest": "sha256:4040404040404040404040404040404040404040404040404040404040404040",
  "scope": {
    "tenant_ids": [
      "TENANT-SYNTHETIC-001"
    ],
    "resource_types": [
      "evidence_bundle"
    ],
    "record_limit": 4,
    "data_classes": [
      "synthetic"
    ],
    "environment_classes": [
      "continuous_integration"
    ]
  },
  "effect_class": "broad_write",
  "evidence_mode": "simulated",
  "authority": "simulation_only",
  "authority_role": "Projected evidence release steward",
  "decision": "approved",
  "rationale": "The synthetic evidence set satisfies the released scope, leakage, provenance, and reproducibility checks for this future-reality run.",
  "constraints": [
    "The call uses the exact approved input digest.",
    "The output remains within the synthetic evidence store."
  ],
  "evidence_artifacts": [
    {
      "artifact_id": "ARTIFACT-APPROVAL-EVIDENCE-001",
      "media_type": "application/json",
      "digest": "sha256:5050505050505050505050505050505050505050505050505050505050505050",
      "locator": "governed://simulation/approvals/evidence-bundle-001",
      "sensitivity": "internal",
      "retention_class": "simulation-baseline"
    }
  ],
  "requested_at": "2026-07-28T18:15:00Z",
  "decided_at": "2026-07-28T18:16:00Z",
  "expires_at": "2026-07-28T19:16:00Z",
  "simulation_context": {
    "future_reality_id": "FUTURE-REALITY-LIMS-2030-001",
    "assumption_ids": [
      "ASSUMPTION-VENDOR-READBACK-001"
    ],
    "production_authorization_effect": "none"
  },
  "metadata": {
    "schema_version": "3.0.0",
    "created_at": "2026-07-28T18:16:00Z",
    "updated_at": "2026-07-28T18:16:00Z",
    "owner": {
      "actor_id": "OWNER-SIMULATION-001",
      "display_name": "Simulation Steward",
      "role": "Projected approval record owner",
      "organization": "Example Laboratory"
    }
  }
}
